[
  {
    "id": "discipline_hri",
    "label": "Human-Robot Interaction",
    "zh_label": "人机机器人交互",
    "type": "Discipline",
    "definition": "研究人与机器人之间的物理、认知、社会和组织互动。",
    "parent": "",
    "children": [],
    "related_nodes": [],
    "evidence": [
      "S01",
      "S23",
      "S33"
    ],
    "design_relevance": "作为整个知识图谱的中心学科。",
    "application_scenarios": [],
    "research_questions": [],
    "portfolio_potential": "",
    "confidence_level": "high"
  },
  {
    "id": "discipline_hci",
    "label": "Human-Computer Interaction",
    "zh_label": "人机交互",
    "type": "Discipline",
    "definition": "研究人与计算系统的交互体验、方法和社会影响。",
    "parent": "",
    "children": [],
    "related_nodes": [],
    "evidence": [
      "S14",
      "S24"
    ],
    "design_relevance": "",
    "application_scenarios": [],
    "research_questions": [],
    "portfolio_potential": "",
    "confidence_level": "high"
  },
  {
    "id": "discipline_robotics",
    "label": "Robotics",
    "zh_label": "机器人学",
    "type": "Discipline",
    "definition": "研究能感知、决策并在物理世界行动的系统。",
    "parent": "",
    "children": [],
    "related_nodes": [],
    "evidence": [
      "S25",
      "S26"
    ],
    "design_relevance": "",
    "application_scenarios": [],
    "research_questions": [],
    "portfolio_potential": "",
    "confidence_level": "high"
  },
  {
    "id": "discipline_design_research",
    "label": "Design Research",
    "zh_label": "设计研究",
    "type": "Discipline",
    "definition": "通过研究方法和设计实践生成设计知识。",
    "parent": "",
    "children": [],
    "related_nodes": [],
    "evidence": [
      "S14",
      "S15"
    ],
    "design_relevance": "",
    "application_scenarios": [],
    "research_questions": [],
    "portfolio_potential": "",
    "confidence_level": "high"
  },
  {
    "id": "discipline_human_factors",
    "label": "Human Factors",
    "zh_label": "人因工程",
    "type": "Discipline",
    "definition": "研究人类能力、限制和系统绩效之间的关系。",
    "parent": "",
    "children": [],
    "related_nodes": [],
    "evidence": [
      "S05",
      "S06",
      "S19",
      "S20"
    ],
    "design_relevance": "",
    "application_scenarios": [],
    "research_questions": [],
    "portfolio_potential": "",
    "confidence_level": "high"
  },
  {
    "id": "discipline_embodied_ai",
    "label": "Embodied AI",
    "zh_label": "具身智能",
    "type": "Discipline",
    "definition": "关注智能体在环境中的感知、行动和 grounding。",
    "parent": "",
    "children": [],
    "related_nodes": [],
    "evidence": [
      "S27",
      "S28",
      "S29"
    ],
    "design_relevance": "连接 AI 与机器人实际行动。",
    "application_scenarios": [],
    "research_questions": [],
    "portfolio_potential": "",
    "confidence_level": "medium"
  },
  {
    "id": "concept_intelligent_interaction_design",
    "label": "Intelligent Interaction Design",
    "zh_label": "智能交互设计",
    "type": "Concept",
    "definition": "面向具备感知、推理、学习或自主能力系统的交互设计。",
    "parent": "",
    "children": [],
    "related_nodes": [
      "discipline_hci",
      "discipline_hri"
    ],
    "evidence": [],
    "design_relevance": "本课题的设计学入口。",
    "application_scenarios": [],
    "research_questions": [],
    "portfolio_potential": "",
    "confidence_level": "medium"
  },
  {
    "id": "concept_embodied_interaction",
    "label": "Embodied Interaction",
    "zh_label": "具身交互",
    "type": "Concept",
    "definition": "行动、身体、空间和情境共同构成交互意义。",
    "parent": "",
    "children": [],
    "related_nodes": [],
    "evidence": [
      "S16"
    ],
    "design_relevance": "帮助设计师关注机器人身体和动作。",
    "application_scenarios": [],
    "research_questions": [],
    "portfolio_potential": "",
    "confidence_level": "high"
  },
  {
    "id": "theory_situated_action",
    "label": "Situated Action",
    "zh_label": "情境行动",
    "type": "Theory",
    "definition": "行动不是计划的机械执行，而是在情境中不断调整。",
    "parent": "",
    "children": [],
    "related_nodes": [],
    "evidence": [
      "S17"
    ],
    "design_relevance": "",
    "application_scenarios": [],
    "research_questions": [],
    "portfolio_potential": "",
    "confidence_level": "high"
  },
  {
    "id": "theory_levels_automation",
    "label": "Levels of Automation",
    "zh_label": "自动化等级理论",
    "type": "Theory",
    "definition": "自动化可分布在信息获取、分析、决策和行动等功能中。",
    "parent": "",
    "children": [],
    "related_nodes": [],
    "evidence": [
      "S07"
    ],
    "design_relevance": "",
    "application_scenarios": [],
    "research_questions": [],
    "portfolio_potential": "",
    "confidence_level": "high"
  },
  {
    "id": "theory_rtd",
    "label": "Research through Design",
    "zh_label": "通过设计进行研究",
    "type": "Theory",
    "definition": "设计产物和反思可以生成 HCI/设计研究知识。",
    "parent": "",
    "children": [],
    "related_nodes": [],
    "evidence": [
      "S14",
      "S15"
    ],
    "design_relevance": "",
    "application_scenarios": [],
    "research_questions": [],
    "portfolio_potential": "",
    "confidence_level": "high"
  },
  {
    "id": "concept_robot_autonomy",
    "label": "Robot Autonomy",
    "zh_label": "机器人自主性",
    "type": "Concept",
    "definition": "机器人独立感知、决策和行动的程度。",
    "parent": "",
    "children": [],
    "related_nodes": [],
    "evidence": [
      "S07",
      "S09"
    ],
    "design_relevance": "决定控制权和责任分配。",
    "application_scenarios": [],
    "research_questions": [],
    "portfolio_potential": "",
    "confidence_level": "high"
  },
  {
    "id": "concept_shared_autonomy",
    "label": "Shared Autonomy",
    "zh_label": "共享自主性",
    "type": "Concept",
    "definition": "人与机器人共同完成控制和决策。",
    "parent": "concept_robot_autonomy",
    "children": [],
    "related_nodes": [
      "concept_human_agency",
      "tech_intention_recognition"
    ],
    "evidence": [],
    "design_relevance": "适合远程操作、辅助控制和复杂服务任务。",
    "application_scenarios": [],
    "research_questions": [],
    "portfolio_potential": "",
    "confidence_level": "medium"
  },
  {
    "id": "concept_human_agency",
    "label": "Human Agency",
    "zh_label": "人类能动性",
    "type": "Concept",
    "definition": "用户保有选择、控制和影响系统行为的能力感。",
    "parent": "",
    "children": [],
    "related_nodes": [
      "concept_robot_autonomy"
    ],
    "evidence": [],
    "design_relevance": "防止智能系统越权。",
    "application_scenarios": [],
    "research_questions": [],
    "portfolio_potential": "",
    "confidence_level": "medium"
  },
  {
    "id": "concept_trust_calibration",
    "label": "Trust Calibration",
    "zh_label": "信任校准",
    "type": "Concept",
    "definition": "让用户信任程度匹配机器人真实能力。",
    "parent": "",
    "children": [],
    "related_nodes": [],
    "evidence": [
      "S05",
      "S06"
    ],
    "design_relevance": "HRI 设计不能只追求更高信任。",
    "application_scenarios": [],
    "research_questions": [],
    "portfolio_potential": "",
    "confidence_level": "high"
  },
  {
    "id": "concept_transparency",
    "label": "Transparency",
    "zh_label": "透明性",
    "type": "Concept",
    "definition": "系统状态、逻辑、边界和不确定性可被用户理解的程度。",
    "parent": "",
    "children": [],
    "related_nodes": [],
    "evidence": [
      "S06"
    ],
    "design_relevance": "支持接管、责任和信任校准。",
    "application_scenarios": [],
    "research_questions": [],
    "portfolio_potential": "",
    "confidence_level": "high"
  },
  {
    "id": "concept_explainability",
    "label": "Explainability",
    "zh_label": "可解释性",
    "type": "Concept",
    "definition": "机器人或 AI 给出与任务相关的理由、限制和不确定性。",
    "parent": "",
    "children": [],
    "related_nodes": [],
    "evidence": [
      "S06",
      "S27"
    ],
    "design_relevance": "连接 LLM agent 与 HRI 责任。",
    "application_scenarios": [],
    "research_questions": [],
    "portfolio_potential": "",
    "confidence_level": "medium"
  },
  {
    "id": "concept_legible_motion",
    "label": "Legible Motion",
    "zh_label": "可读运动",
    "type": "Concept",
    "definition": "机器人动作能让人快速推断目标。",
    "parent": "",
    "children": [],
    "related_nodes": [],
    "evidence": [
      "S13"
    ],
    "design_relevance": "对协作机器人和公共空间机器人非常关键。",
    "application_scenarios": [],
    "research_questions": [],
    "portfolio_potential": "",
    "confidence_level": "high"
  },
  {
    "id": "concept_predictability",
    "label": "Predictability",
    "zh_label": "可预测性",
    "type": "Concept",
    "definition": "机器人行为符合用户预期。",
    "parent": "",
    "children": [],
    "related_nodes": [],
    "evidence": [
      "S13"
    ],
    "design_relevance": "",
    "application_scenarios": [],
    "research_questions": [],
    "portfolio_potential": "",
    "confidence_level": "high"
  },
  {
    "id": "concept_situation_awareness",
    "label": "Situation Awareness",
    "zh_label": "情境感知",
    "type": "Concept",
    "definition": "用户理解当前环境、意义和未来变化。",
    "parent": "",
    "children": [],
    "related_nodes": [],
    "evidence": [
      "S20"
    ],
    "design_relevance": "",
    "application_scenarios": [],
    "research_questions": [],
    "portfolio_potential": "",
    "confidence_level": "high"
  },
  {
    "id": "concept_social_presence",
    "label": "Social Presence",
    "zh_label": "社会临场感",
    "type": "Concept",
    "definition": "机器人被感知为社会参与者的程度。",
    "parent": "",
    "children": [],
    "related_nodes": [],
    "evidence": [
      "S02",
      "S03",
      "S04"
    ],
    "design_relevance": "",
    "application_scenarios": [],
    "research_questions": [],
    "portfolio_potential": "",
    "confidence_level": "high"
  },
  {
    "id": "concept_anthropomorphism",
    "label": "Anthropomorphism",
    "zh_label": "拟人化",
    "type": "Concept",
    "definition": "用户将人类特质归因给机器人。",
    "parent": "",
    "children": [],
    "related_nodes": [],
    "evidence": [
      "S04"
    ],
    "design_relevance": "",
    "application_scenarios": [],
    "research_questions": [],
    "portfolio_potential": "",
    "confidence_level": "high"
  },
  {
    "id": "concept_failure_recovery",
    "label": "Failure Recovery",
    "zh_label": "失败恢复",
    "type": "Concept",
    "definition": "系统识别、解释并补救失败的能力。",
    "parent": "",